<?xml version='1.0' encoding='utf-8'?>
<itemList xmlns:xsi="http://www.w3.org/2001/XMLSchema-instance" xmlns="http://la2j.org"
          xsi:schemaLocation="http://la2j.org ../item.xsd">
    <item id='1660' name="cursed_maingauche">

        <stat function='add' value='62' order='8' name='PHYSIC_ATTACK'/>
        <stat function='add' value='42' order='8' name='MAGIC_ATTACK'/>
        <stat function='add' value='12' order='8' name='CRITICAL_RATE'/>
        <stat function='add' value='-3' order='16' name='ACCURACY'/>
        <stat function='add' value='433' order='8' name='PHYSIC_ATTACK_SPEED'/>
        <stat function='enchant' value='0' order='12' name='PHYSIC_ATTACK'/>
        <stat function='enchant' value='0' order='12' name='MAGIC_ATTACK'/>

    </item>
</itemList>