<?xml version='1.0' encoding='utf-8'?>
<itemList xmlns:xsi="http://www.w3.org/2001/XMLSchema-instance" xmlns="http://la2j.org"
          xsi:schemaLocation="http://la2j.org ../item.xsd">
    <item id='8203' name="(monster_only)venom_sword">

        <stat function='add' value='0' order='8' name='PHYSIC_ATTACK'/>
        <stat function='add' value='0' order='8' name='MAGIC_ATTACK'/>
        <stat function='add' value='0' order='8' name='CRITICAL_RATE'/>
        <stat function='add' value='0' order='16' name='ACCURACY'/>
        <stat function='add' value='325' order='8' name='PHYSIC_ATTACK_SPEED'/>

    </item>
    <item id='8204' name="(monster_only)frintessa_follower_calibur">

        <stat function='add' value='0' order='8' name='PHYSIC_ATTACK'/>
        <stat function='add' value='0' order='8' name='MAGIC_ATTACK'/>
        <stat function='add' value='0' order='8' name='CRITICAL_RATE'/>
        <stat function='add' value='0' order='16' name='ACCURACY'/>
        <stat function='add' value='379' order='8' name='PHYSIC_ATTACK_SPEED'/>

    </item>
    <item id='8205' name="(monster_only)heretic_priest_sickle">

        <stat function='add' value='0' order='8' name='PHYSIC_ATTACK'/>
        <stat function='add' value='0' order='8' name='MAGIC_ATTACK'/>
        <stat function='add' value='0' order='8' name='CRITICAL_RATE'/>
        <stat function='add' value='0' order='16' name='ACCURACY'/>
        <stat function='add' value='325' order='8' name='PHYSIC_ATTACK_SPEED'/>

    </item>
    <item id='8206' name="(monster_only)heretic_priest_sword">

        <stat function='add' value='0' order='8' name='PHYSIC_ATTACK'/>
        <stat function='add' value='0' order='8' name='MAGIC_ATTACK'/>
        <stat function='add' value='0' order='8' name='CRITICAL_RATE'/>
        <stat function='add' value='0' order='16' name='ACCURACY'/>
        <stat function='add' value='325' order='8' name='PHYSIC_ATTACK_SPEED'/>

    </item>
    <item id='8207' name="(monster_only)heretic_privates_axe">

        <stat function='add' value='0' order='8' name='PHYSIC_ATTACK'/>
        <stat function='add' value='0' order='8' name='MAGIC_ATTACK'/>
        <stat function='add' value='0' order='8' name='CRITICAL_RATE'/>
        <stat function='add' value='0' order='16' name='ACCURACY'/>
        <stat function='add' value='325' order='8' name='PHYSIC_ATTACK_SPEED'/>

    </item>
    <item id='8208' name="(monster_only)heretic_privates_staff">

        <stat function='add' value='0' order='8' name='PHYSIC_ATTACK'/>
        <stat function='add' value='0' order='8' name='MAGIC_ATTACK'/>
        <stat function='add' value='0' order='8' name='CRITICAL_RATE'/>
        <stat function='add' value='0' order='16' name='ACCURACY'/>
        <stat function='add' value='325' order='8' name='PHYSIC_ATTACK_SPEED'/>

    </item>
    <item id='8209' name="(monster_only)lidia_von_helmanns_sword">

        <stat function='add' value='0' order='8' name='PHYSIC_ATTACK'/>
        <stat function='add' value='0' order='8' name='MAGIC_ATTACK'/>
        <stat function='add' value='0' order='8' name='CRITICAL_RATE'/>
        <stat function='add' value='0' order='16' name='ACCURACY'/>
        <stat function='add' value='379' order='8' name='PHYSIC_ATTACK_SPEED'/>

    </item>
    <item id='8210' name="(monster_only)monk_warrior_shield">

        <stat function='sub' value='8' order='16' name='EVASION_RATE'/>
        <stat function='add' value='230' order='8' name='SHIELD_DEFENCE'/>
        <stat function='add' value='20' order='8' name='SHIELD_RATE'/>

    </item>
    <item id='8211' name="(monster_only)monk_warrior_sword">

        <stat function='add' value='0' order='8' name='PHYSIC_ATTACK'/>
        <stat function='add' value='0' order='8' name='MAGIC_ATTACK'/>
        <stat function='add' value='0' order='8' name='CRITICAL_RATE'/>
        <stat function='add' value='0' order='16' name='ACCURACY'/>
        <stat function='add' value='379' order='8' name='PHYSIC_ATTACK_SPEED'/>

    </item>
    <item id='8212' name="(monster_only)solina_brother_mace">

        <stat function='add' value='0' order='8' name='PHYSIC_ATTACK'/>
        <stat function='add' value='0' order='8' name='MAGIC_ATTACK'/>
        <stat function='add' value='0' order='8' name='CRITICAL_RATE'/>
        <stat function='add' value='0' order='16' name='ACCURACY'/>
        <stat function='add' value='379' order='8' name='PHYSIC_ATTACK_SPEED'/>

    </item>
    <item id='8213' name="(monster_only)solina_father_mace">

        <stat function='add' value='0' order='8' name='PHYSIC_ATTACK'/>
        <stat function='add' value='0' order='8' name='MAGIC_ATTACK'/>
        <stat function='add' value='0' order='8' name='CRITICAL_RATE'/>
        <stat function='add' value='0' order='16' name='ACCURACY'/>
        <stat function='add' value='379' order='8' name='PHYSIC_ATTACK_SPEED'/>

    </item>
    <item id='8214' name="(monster_only)solina_priest_pole">

        <stat function='add' value='0' order='8' name='PHYSIC_ATTACK'/>
        <stat function='add' value='0' order='8' name='MAGIC_ATTACK'/>
        <stat function='add' value='0' order='8' name='CRITICAL_RATE'/>
        <stat function='add' value='66' order='8' name='PHYSIC_ATTACK_RANGE'/>
        <stat function='add' value='0' order='16' name='ACCURACY'/>
        <stat function='add' value='325' order='8' name='PHYSIC_ATTACK_SPEED'/>

    </item>
    <item id='8215' name="(monster_only)zombie_enlisted_man_sword">

        <stat function='add' value='0' order='8' name='PHYSIC_ATTACK'/>
        <stat function='add' value='00' order='8' name='MAGIC_ATTACK'/>
        <stat function='add' value='0' order='8' name='CRITICAL_RATE'/>
        <stat function='add' value='0' order='16' name='ACCURACY'/>
        <stat function='add' value='325' order='8' name='PHYSIC_ATTACK_SPEED'/>

    </item>
    <item id='8216' name="(monster_only)zombie_enlisted_man_claw">

        <stat function='add' value='0' order='8' name='PHYSIC_ATTACK'/>
        <stat function='add' value='0' order='8' name='MAGIC_ATTACK'/>
        <stat function='add' value='4' order='8' name='CRITICAL_RATE'/>
        <stat function='add' value='4' order='16' name='ACCURACY'/>
        <stat function='add' value='325' order='8' name='PHYSIC_ATTACK_SPEED'/>

    </item>
    <item id='8217' name="(monster_only)zombie_gateguard_spear">

        <stat function='add' value='0' order='8' name='PHYSIC_ATTACK'/>
        <stat function='add' value='0' order='8' name='MAGIC_ATTACK'/>
        <stat function='add' value='8' order='8' name='CRITICAL_RATE'/>
        <stat function='add' value='66' order='8' name='PHYSIC_ATTACK_RANGE'/>
        <stat function='add' value='0' order='16' name='ACCURACY'/>
        <stat function='add' value='379' order='8' name='PHYSIC_ATTACK_SPEED'/>

    </item>
    <item id='8218' name="(monster_only)zombie_laborer_axe">

        <stat function='add' value='0' order='8' name='PHYSIC_ATTACK'/>
        <stat function='add' value='0' order='8' name='MAGIC_ATTACK'/>
        <stat function='add' value='4' order='8' name='CRITICAL_RATE'/>
        <stat function='add' value='4' order='16' name='ACCURACY'/>
        <stat function='add' value='379' order='8' name='PHYSIC_ATTACK_SPEED'/>

    </item>
    <item id='8219' name="(monster_only)zombie_laborer_sword">

        <stat function='add' value='0' order='8' name='PHYSIC_ATTACK'/>
        <stat function='add' value='0' order='8' name='MAGIC_ATTACK'/>
        <stat function='add' value='8' order='8' name='CRITICAL_RATE'/>
        <stat function='add' value='0' order='16' name='ACCURACY'/>
        <stat function='add' value='379' order='8' name='PHYSIC_ATTACK_SPEED'/>

    </item>
    <item id='8220' name="(monster_only)apostle_grail_bow">

        <stat function='add' value='0' order='8' name='PHYSIC_ATTACK'/>
        <stat function='add' value='0' order='8' name='MAGIC_ATTACK'/>
        <stat function='add' value='12' order='8' name='CRITICAL_RATE'/>
        <stat function='add' value='-3' order='16' name='ACCURACY'/>
        <stat function='add' value='293' order='8' name='PHYSIC_ATTACK_SPEED'/>

    </item>
    <item id='8221' name="(monster_only)apostle_grail_spear">

        <stat function='add' value='0' order='8' name='PHYSIC_ATTACK'/>
        <stat function='add' value='0' order='8' name='MAGIC_ATTACK'/>
        <stat function='add' value='8' order='8' name='CRITICAL_RATE'/>
        <stat function='add' value='66' order='8' name='PHYSIC_ATTACK_RANGE'/>
        <stat function='add' value='-3' order='16' name='ACCURACY'/>
        <stat function='add' value='325' order='8' name='PHYSIC_ATTACK_SPEED'/>

    </item>
    <item id='8222' name="(monster_only)frintessa_follower_tran_calibur">

        <stat function='add' value='0' order='8' name='PHYSIC_ATTACK'/>
        <stat function='add' value='0' order='8' name='MAGIC_ATTACK'/>
        <stat function='add' value='8' order='8' name='CRITICAL_RATE'/>
        <stat function='add' value='0' order='16' name='ACCURACY'/>
        <stat function='add' value='379' order='8' name='PHYSIC_ATTACK_SPEED'/>

    </item>
</itemList>