<?xml version='1.0' encoding='utf-8'?>
<itemList xmlns:xsi="http://www.w3.org/2001/XMLSchema-instance" xmlns="http://la2j.org"
          xsi:schemaLocation="http://la2j.org ../item.xsd">
    <item id='6715' name="monster_only(silenos_archer)">

        <stat function='add' value='16' order='8' name='PHYSIC_ATTACK'/>
        <stat function='add' value='6' order='8' name='MAGIC_ATTACK'/>
        <stat function='add' value='12' order='8' name='CRITICAL_RATE'/>
        <stat function='add' value='-3' order='16' name='ACCURACY'/>
        <stat function='add' value='293' order='8' name='PHYSIC_ATTACK_SPEED'/>
        <stat function='enchant' value='0' order='12' name='PHYSIC_ATTACK'/>
        <stat function='enchant' value='0' order='12' name='MAGIC_ATTACK'/>

    </item>
    <item id='6716' name="monster_only(silenos_shaman)">

        <stat function='add' value='11' order='8' name='PHYSIC_ATTACK'/>
        <stat function='add' value='12' order='8' name='MAGIC_ATTACK'/>
        <stat function='add' value='4' order='8' name='CRITICAL_RATE'/>
        <stat function='add' value='4' order='16' name='ACCURACY'/>
        <stat function='add' value='325' order='8' name='PHYSIC_ATTACK_SPEED'/>
        <stat function='enchant' value='0' order='12' name='PHYSIC_ATTACK'/>
        <stat function='enchant' value='0' order='12' name='MAGIC_ATTACK'/>

    </item>
    <item id='6717' name="monster_only(einhasad_warrior)">

        <stat function='add' value='24' order='8' name='PHYSIC_ATTACK'/>
        <stat function='add' value='17' order='8' name='MAGIC_ATTACK'/>
        <stat function='add' value='8' order='8' name='CRITICAL_RATE'/>
        <stat function='add' value='0' order='16' name='ACCURACY'/>
        <stat function='add' value='379' order='8' name='PHYSIC_ATTACK_SPEED'/>
        <stat function='enchant' value='0' order='12' name='PHYSIC_ATTACK'/>
        <stat function='enchant' value='0' order='12' name='MAGIC_ATTACK'/>

    </item>
    <item id='6718' name="monster_only(einhasad_shaman)">

        <stat function='add' value='24' order='8' name='PHYSIC_ATTACK'/>
        <stat function='add' value='17' order='8' name='MAGIC_ATTACK'/>
        <stat function='add' value='4' order='8' name='CRITICAL_RATE'/>
        <stat function='add' value='4' order='16' name='ACCURACY'/>
        <stat function='add' value='325' order='8' name='PHYSIC_ATTACK_SPEED'/>
        <stat function='enchant' value='0' order='12' name='PHYSIC_ATTACK'/>
        <stat function='enchant' value='0' order='12' name='MAGIC_ATTACK'/>

    </item>
    <item id='6719' name="monster_only(ketra_orc_chieftain)">

        <stat function='add' value='141' order='8' name='PHYSIC_ATTACK'/>
        <stat function='add' value='104' order='8' name='MAGIC_ATTACK'/>
        <stat function='add' value='4' order='8' name='CRITICAL_RATE'/>
        <stat function='add' value='4' order='16' name='ACCURACY'/>
        <stat function='add' value='325' order='8' name='PHYSIC_ATTACK_SPEED'/>
        <stat function='enchant' value='0' order='12' name='PHYSIC_ATTACK'/>
        <stat function='enchant' value='0' order='12' name='MAGIC_ATTACK'/>

    </item>
    <item id='6720' name="monster_only(shadow_of_halisha)">

        <stat function='add' value='16' order='8' name='PHYSIC_ATTACK'/>
        <stat function='add' value='6' order='8' name='MAGIC_ATTACK'/>
        <stat function='add' value='12' order='8' name='CRITICAL_RATE'/>
        <stat function='add' value='-3' order='16' name='ACCURACY'/>
        <stat function='add' value='293' order='8' name='PHYSIC_ATTACK_SPEED'/>
        <stat function='enchant' value='0' order='12' name='PHYSIC_ATTACK'/>
        <stat function='enchant' value='0' order='12' name='MAGIC_ATTACK'/>

    </item>
    <item id='6721' name="monster_only(shield_of_imperial_warlord">

        <stat function='sub' value='8' order='16' name='EVASION_RATE'/>
        <stat function='add' value='47' order='8' name='SHIELD_DEFENCE'/>
        <stat function='add' value='20' order='8' name='SHIELD_RATE'/>
        <stat function='enchant' value='0' order='12' name='SHIELD_DEFENCE'/>

    </item>
    <item id='6722' name="monster_only(ahrimanes)">

        <stat function='add' value='236' order='8' name='PHYSIC_ATTACK'/>
        <stat function='add' value='99' order='8' name='MAGIC_ATTACK'/>
        <stat function='add' value='8' order='8' name='CRITICAL_RATE'/>
        <stat function='add' value='0' order='16' name='ACCURACY'/>
        <stat function='add' value='325' order='8' name='PHYSIC_ATTACK_SPEED'/>
        <stat function='enchant' value='0' order='12' name='PHYSIC_ATTACK'/>
        <stat function='enchant' value='0' order='12' name='MAGIC_ATTACK'/>

    </item>
    <item id='6723' name="monster_only(vampire_warrior)">

        <stat function='add' value='112' order='8' name='PHYSIC_ATTACK'/>
        <stat function='add' value='54' order='8' name='MAGIC_ATTACK'/>
        <stat function='add' value='8' order='8' name='CRITICAL_RATE'/>
        <stat function='add' value='0' order='16' name='ACCURACY'/>
        <stat function='add' value='325' order='8' name='PHYSIC_ATTACK_SPEED'/>
        <stat function='enchant' value='0' order='12' name='PHYSIC_ATTACK'/>
        <stat function='enchant' value='0' order='12' name='MAGIC_ATTACK'/>

    </item>
</itemList>