<?xml version='1.0' encoding='utf-8'?>
<itemList xmlns:xsi="http://www.w3.org/2001/XMLSchema-instance"
          xmlns="http://la2j.org" xsi:schemaLocation="http://la2j.org ../item.xsd">

    <item id='8541' name="Little Harness">

        <stat function='add' value='25' order='16' name='MAGIC_DEFENCE'/>
        <stat function='add' value='10' order='16' name='PHYSIC_DEFENCE'/>

    </item>
    <item id='8552' name="Mask of Spirits">

        <stat function='add' value='0' order='16' name='PHYSIC_DEFENCE'/>

    </item>
    <item id='8557' name="Blue Party Hat">

        <stat function='add' value='0' order='16' name='PHYSIC_DEFENCE'/>

    </item>
    <item id='8558' name="Eva's Mark">

        <stat function='add' value='0' order='16' name='PHYSIC_DEFENCE'/>

    </item>
    <item id='8559' name="Diadem">

        <stat function='add' value='0' order='16' name='PHYSIC_DEFENCE'/>

    </item>
    <item id='8560' name="Teddy Bear Hat">

        <stat function='add' value='0' order='16' name='PHYSIC_DEFENCE'/>

    </item>
    <item id='8561' name="Piggy Hat">

        <stat function='add' value='0' order='16' name='PHYSIC_DEFENCE'/>

    </item>
    <item id='8562' name="Jester Hat">

        <stat function='add' value='0' order='16' name='PHYSIC_DEFENCE'/>

    </item>
    <item id='8563' name="Wizard's Hat">

        <stat function='add' value='0' order='16' name='PHYSIC_DEFENCE'/>

    </item>
    <item id='8564' name="Dapper Cap">

        <stat function='add' value='0' order='16' name='PHYSIC_DEFENCE'/>

    </item>
    <item id='8565' name="Romantic Chapeau">

        <stat function='add' value='0' order='16' name='PHYSIC_DEFENCE'/>

    </item>
    <item id='8566' name="Iron Circlet">

        <stat function='add' value='0' order='16' name='PHYSIC_DEFENCE'/>

    </item>
    <item id='8567' name="valueakas Slayer Circlet">

        <stat function='add' value='0' order='16' name='PHYSIC_DEFENCE'/>

    </item>
    <item id='8568' name="Antharas Slayer Circlet">

        <stat function='add' value='0' order='16' name='PHYSIC_DEFENCE'/>

    </item>
    <item id='8569' name="Half Face Mask">

        <stat function='add' value='0' order='16' name='PHYSIC_DEFENCE'/>

    </item>
</itemList>