<?xml version='1.0' encoding='utf-8'?>
<itemList xmlns:xsi="http://www.w3.org/2001/XMLSchema-instance" xmlns="http://la2j.org"
          xsi:schemaLocation="http://la2j.org ../item.xsd">
    <item id='4900' name="staff_of_evil_spirit_magic_focus">

        <stat function='add' value='189' order='8' name='PHYSIC_ATTACK'/>
        <stat function='add' value='132' order='8' name='MAGIC_ATTACK'/>
        <stat function='add' value='4' order='8' name='CRITICAL_RATE'/>
        <stat function='add' value='4' order='16' name='ACCURACY'/>
        <stat function='add' value='325' order='8' name='PHYSIC_ATTACK_SPEED'/>
        <stat function='enchant' value='0' order='12' name='PHYSIC_ATTACK'/>
        <stat function='enchant' value='0' order='12' name='MAGIC_ATTACK'/>
        <!-- Magic Focus -->
        <skill triggerType="onCast" id='1077' level='3' chance='20'/>

    </item>
    <item id='4901' name="staff_of_evil_spirit_bodily_blessing">

        <stat function='add' value='189' order='8' name='PHYSIC_ATTACK'/>
        <stat function='add' value='132' order='8' name='MAGIC_ATTACK'/>
        <stat function='add' value='4' order='8' name='CRITICAL_RATE'/>
        <stat function='add' value='4' order='16' name='ACCURACY'/>
        <stat function='add' value='325' order='8' name='PHYSIC_ATTACK_SPEED'/>
        <stat function='enchant' value='0' order='12' name='PHYSIC_ATTACK'/>
        <stat function='enchant' value='0' order='12' name='MAGIC_ATTACK'/>
        <!-- Bodily Blessing -->
        <skill triggerType='onCast' id='1045' level='5' chance='20'/>

    </item>
    <item id='4902' name="staff_of_evil_spirit_magic_poison">

        <stat function='add' value='189' order='8' name='PHYSIC_ATTACK'/>
        <stat function='add' value='132' order='8' name='MAGIC_ATTACK'/>
        <stat function='add' value='4' order='8' name='CRITICAL_RATE'/>
        <stat function='add' value='4' order='16' name='ACCURACY'/>
        <stat function='add' value='325' order='8' name='PHYSIC_ATTACK_SPEED'/>
        <stat function='enchant' value='0' order='12' name='PHYSIC_ATTACK'/>
        <stat function='enchant' value='0' order='12' name='MAGIC_ATTACK'/>
        <skill id="1168" triggerType="onCast" level="6" chance="6"/>

    </item>
    <item id='4903' name="dasparions_staff">

        <stat function='add' value='207' order='8' name='PHYSIC_ATTACK'/>
        <stat function='add' value='143' order='8' name='MAGIC_ATTACK'/>
        <stat function='add' value='4' order='8' name='CRITICAL_RATE'/>
        <stat function='add' value='4' order='16' name='ACCURACY'/>
        <stat function='add' value='325' order='8' name='PHYSIC_ATTACK_SPEED'/>
        <stat function='enchant' value='0' order='12' name='PHYSIC_ATTACK'/>
        <stat function='enchant' value='0' order='12' name='MAGIC_ATTACK'/>
        <stat function='mul' value='1.25' order='48' name='MAX_HP'/>

    </item>
    <item id='4904' name="dasparions_staff">

        <stat function='add' value='207' order='8' name='PHYSIC_ATTACK'/>
        <stat function='add' value='143' order='8' name='MAGIC_ATTACK'/>
        <stat function='add' value='4' order='8' name='CRITICAL_RATE'/>
        <stat function='add' value='4' order='16' name='ACCURACY'/>
        <stat function='add' value='325' order='8' name='PHYSIC_ATTACK_SPEED'/>
        <stat function='enchant' value='0' order='12' name='PHYSIC_ATTACK'/>
        <stat function='enchant' value='0' order='12' name='MAGIC_ATTACK'/>

    </item>
    <item id='4905' name="dasparions_staff">

        <stat function='add' value='207' order='8' name='PHYSIC_ATTACK'/>
        <stat function='add' value='143' order='8' name='MAGIC_ATTACK'/>
        <stat function='add' value='4' order='8' name='CRITICAL_RATE'/>
        <stat function='add' value='4' order='16' name='ACCURACY'/>
        <stat function='add' value='325' order='8' name='PHYSIC_ATTACK_SPEED'/>
        <stat function='enchant' value='0' order='12' name='PHYSIC_ATTACK'/>
        <stat function='enchant' value='0' order='12' name='MAGIC_ATTACK'/>

    </item>
</itemList>